{
  "schema": "smi-visual-collection/1",
  "collection_id": "smi.examples.collection.animated-icons",
  "name": "Animated Pulse Icon",
  "version": "1.0.0",
  "description": "Original geometric starter and reference manifest. Simple tutorial art, not a finished commercial design.",
  "entry_asset": "smi.example.pulse",
  "packs": [
    {
      "manifest": "manifest.json",
      "label": "Animated Icons",
      "category": "animated-icon"
    }
  ]
}
